{"sources":{"modding":{"source_id":"modding","source_class":"OFFICIAL","source_role":"DEVELOPER_WIKI","canonical_url_or_origin":"https://softwareinc.coredumping.com/wiki/index.php/Modding","currency":"TARGET_BRANCH","scope":"ENGINE_GENERAL","retrieved_at":"2026-09-01","status":"ACTIVE","revision_id":1374},"data_modding":{"source_id":"data_modding","source_class":"OFFICIAL","source_role":"DEVELOPER_WIKI","canonical_url_or_origin":"https://softwareinc.coredumping.com/wiki/index.php/Data_Modding","currency":"TARGET_BRANCH","scope":"ENGINE_GENERAL","retrieved_at":"2026-09-01","status":"ACTIVE","revision_id":956},"code_modding":{"source_id":"code_modding","source_class":"OFFICIAL","source_role":"DEVELOPER_WIKI","canonical_url_or_origin":"https://softwareinc.coredumping.com/wiki/index.php/Code_Modding","currency":"TARGET_BRANCH","scope":"ENGINE_GENERAL","retrieved_at":"2026-09-01","status":"ACTIVE","revision_id":1375},"sipl":{"source_id":"sipl","source_class":"OFFICIAL","source_role":"DEVELOPER_WIKI","canonical_url_or_origin":"https://softwareinc.coredumping.com/wiki/index.php/SIPL","currency":"TARGET_BRANCH","scope":"ENGINE_GENERAL","retrieved_at":"2026-09-01","status":"ACTIVE","revision_id":1282},"furniture":{"source_id":"furniture","source_class":"OFFICIAL","source_role":"DEVELOPER_WIKI","canonical_url_or_origin":"https://softwareinc.coredumping.com/wiki/index.php/Furniture_Modding","currency":"TARGET_BRANCH","scope":"ENGINE_GENERAL","retrieved_at":"2026-09-01","status":"ACTIVE","revision_id":1246},"material":{"source_id":"material","source_class":"OFFICIAL","source_role":"DEVELOPER_WIKI","canonical_url_or_origin":"https://softwareinc.coredumping.com/wiki/index.php/Material_Modding","currency":"TARGET_BRANCH","scope":"ENGINE_GENERAL","retrieved_at":"2026-09-01","status":"ACTIVE","revision_id":939},"tyd":{"source_id":"tyd","source_class":"OFFICIAL","source_role":"DEVELOPER_WIKI","canonical_url_or_origin":"https://softwareinc.coredumping.com/wiki/index.php/TyD","currency":"TARGET_BRANCH","scope":"ENGINE_GENERAL","retrieved_at":"2026-09-01","status":"ACTIVE","revision_id":548},"hardware_design":{"source_id":"hardware_design","source_class":"OFFICIAL","source_role":"DEVELOPER_WIKI","canonical_url_or_origin":"https://softwareinc.coredumping.com/wiki/index.php/Hardware_Design","currency":"TARGET_BRANCH","scope":"ENGINE_GENERAL","retrieved_at":"2026-09-01","status":"ACTIVE","revision_id":898},"console":{"source_id":"console","source_class":"OFFICIAL","source_role":"DEVELOPER_WIKI","canonical_url_or_origin":"https://softwareinc.coredumping.com/wiki/index.php/Console","currency":"TARGET_BRANCH","scope":"ENGINE_GENERAL","retrieved_at":"2026-09-01","status":"ACTIVE","revision_id":942},"patch_1_8_34":{"source_id":"patch_1_8_34","source_class":"OFFICIAL","source_role":"OFFICIAL_PATCH_NOTE","canonical_url_or_origin":"https://coredumping.itch.io/software-inc/devlog/1414144/patch-notes-for-beta-1834","currency":"TARGET_BRANCH","scope":"API_OR_SCHEMA","retrieved_at":"2026-09-01","status":"ACTIVE"},"tyd_fork":{"source_id":"tyd_fork","source_class":"PRIMARY_MOD_SOURCE","source_role":"ENGINE_FORK_SOURCE","canonical_url_or_origin":"https://github.com/khornel/TyDSharp","currency":"NOT_VERSION_SENSITIVE","scope":"API_OR_SCHEMA","retrieved_at":"2026-09-01","status":"ACTIVE"},"unity_horizontal":{"source_id":"unity_horizontal","source_class":"OFFICIAL","source_role":"LINKED_ENGINE_API","canonical_url_or_origin":"https://docs.unity3d.com/2018.2/Documentation/ScriptReference/UI.HorizontalLayoutGroup.html","currency":"UNKNOWN_VERSION","scope":"API_OR_SCHEMA","retrieved_at":"2026-09-01","status":"ACTIVE","delegated_by":"code_modding","linked_from":"Code_Modding#Creating_UI"},"unity_vertical":{"source_id":"unity_vertical","source_class":"OFFICIAL","source_role":"LINKED_ENGINE_API","canonical_url_or_origin":"https://docs.unity3d.com/2018.2/Documentation/ScriptReference/UI.VerticalLayoutGroup.html","currency":"UNKNOWN_VERSION","scope":"API_OR_SCHEMA","retrieved_at":"2026-09-01","status":"ACTIVE","delegated_by":"code_modding","linked_from":"Code_Modding#Creating_UI"},"unity_grid":{"source_id":"unity_grid","source_class":"OFFICIAL","source_role":"LINKED_ENGINE_API","canonical_url_or_origin":"https://docs.unity3d.com/2018.2/Documentation/ScriptReference/UI.GridLayoutGroup.html","currency":"UNKNOWN_VERSION","scope":"API_OR_SCHEMA","retrieved_at":"2026-09-01","status":"ACTIVE","delegated_by":"code_modding","linked_from":"Code_Modding#Creating_UI"},"unity_content_fitter":{"source_id":"unity_content_fitter","source_class":"OFFICIAL","source_role":"LINKED_ENGINE_API","canonical_url_or_origin":"https://docs.unity3d.com/2018.2/Documentation/ScriptReference/UI.ContentSizeFitter.html","currency":"UNKNOWN_VERSION","scope":"API_OR_SCHEMA","retrieved_at":"2026-09-01","status":"ACTIVE","delegated_by":"code_modding","linked_from":"Code_Modding#Creating_UI"},"unity_layout_element":{"source_id":"unity_layout_element","source_class":"OFFICIAL","source_role":"LINKED_ENGINE_API","canonical_url_or_origin":"https://docs.unity3d.com/2018.2/Documentation/ScriptReference/UI.LayoutElement.html","currency":"UNKNOWN_VERSION","scope":"API_OR_SCHEMA","retrieved_at":"2026-09-01","status":"ACTIVE","delegated_by":"code_modding","linked_from":"Code_Modding#Creating_UI"},"beta17_corpus":{"source_id":"beta17_corpus","source_class":"VANILLA","source_role":"OLDER_VANILLA_CORPUS","canonical_url_or_origin":"local supplied Beta17Data archive","currency":"OLDER_VERSION","scope":"VANILLA_CONTENT","retrieved_at":"2026-09-01","status":"ACTIVE"}},"claims":{},"corpora":{"beta17":{"corpus_id":"beta17","source_role":"OLDER_VANILLA_CORPUS","game_version":"Beta 1.7.15","capture_provenance":{"archive_sha256":"29685ddc23cbcf1d3e1488c29aeeb09612d9ddd79c346949361b863fd325b02d","manifest":"work/corpus/beta-1.7.15/manifest.json"}}},"media":{}}
